{"$schema":"https://json-schema.org/draft/2020-12/schema","$id":"CTR-API-001","title":"API command/query envelope","type":"object","additionalProperties":false,"required":["api_version","kind","request_id","correlation_id","tenant_context"],"properties":{"api_version":{"type":"integer","minimum":1},"kind":{"enum":["success","error","accepted"]},"request_id":{"type":"string","minLength":1},"correlation_id":{"type":"string","minLength":1},"causation_id":{"type":"string","minLength":1},"tenant_context":{"$ref":"../ctr-ten-001/schema.json"},"data":{"type":"object","x-leakage-boundary":"This contract does NOT constrain the shape of `data`. API-001 forbids leaking internal detail, and that rule is enforced here only on the error branch (`error.details` must be empty). `data` is the branch that carries generated content, so a raw provider response or a stack trace placed in it is accepted by this contract. Per-command response schemas MUST constrain it; this envelope cannot. Raised by independent security review and recorded rather than silently left open."},"error":{"$ref":"../ctr-err-001/schema.json"},"accepted":{"type":"object","additionalProperties":false,"required":["job_id","status_ref"],"properties":{"job_id":{"type":"string","minLength":1},"status_ref":{"type":"string","minLength":1,"pattern":"^(job|status|result|app|asset|content):[A-Za-z0-9._/-]+$","x-reference-rule":"An ALLOW-list of internal reference schemes. The previous rule only rejected a literal lowercase http(s) prefix; independent security review showed HTTPS:// in uppercase, //host, ftp:, data:, file:///etc/passwd, javascript: and ../../../etc/passwd all passed it. A deny-list cannot enumerate what must not appear."},"deep_link_ref":{"type":"string","minLength":1,"pattern":"^(job|status|result|app|asset|content):[A-Za-z0-9._/-]+$","x-reference-rule":"An ALLOW-list of internal reference schemes. The previous rule only rejected a literal lowercase http(s) prefix; independent security review showed HTTPS:// in uppercase, //host, ftp:, data:, file:///etc/passwd, javascript: and ../../../etc/passwd all passed it. A deny-list cannot enumerate what must not appear."}}}},"allOf":[{"if":{"properties":{"kind":{"const":"success"}}},"then":{"required":["data"],"not":{"anyOf":[{"required":["error"]},{"required":["accepted"]}]}}},{"if":{"properties":{"kind":{"const":"error"}}},"then":{"required":["error"],"not":{"anyOf":[{"required":["data"]},{"required":["accepted"]}]}}},{"if":{"properties":{"kind":{"const":"accepted"}}},"then":{"required":["accepted"],"not":{"anyOf":[{"required":["data"]},{"required":["error"]}]}}}]}
