{"api_version":1,"request_id":"req_synthetic_0001","correlation_id":"cor_synthetic_0001","tenant_context":{"workspace_id":"ws_synthetic_0001","actor":{"kind":"user","id":"usr_synthetic_0001"},"request_id":"req_synthetic_0001","correlation_id":"cor_synthetic_0001","locale":"th-TH","timezone":"Asia/Bangkok"},"kind":"success","data":{}}
