{"api_version":1,"request_id":"req_synthetic_0001","correlation_id":"cor_synthetic_0001","tenant_context":{"workspace_id":"ws_synthetic_0001","actor":{"kind":"user","id":"usr_synthetic_0001"},"request_id":"req_synthetic_0001","correlation_id":"cor_synthetic_0001","locale":"th-TH","timezone":"Asia/Bangkok"},"kind":"accepted","accepted":{"job_id":"job_synthetic_0001","status_ref":"job:job_synthetic_0001/status","deep_link_ref":"app:/content/job_synthetic_0001"}}
